{
  "schema": "stratadiff-coderabbit-governor-evidence-v1",
  "generated_at": "2026-09-07T12:02:01Z",
  "provider": "coderabbit",
  "repository": "acme/widget",
  "pull_request_number": 7,
  "expected_base_sha": "cccccccccccccccccccccccccccccccccccccccc",
  "observed_base_sha": "cccccccccccccccccccccccccccccccccccccccc",
  "expected_head_sha": "aaaaaaaaaaaaaaaaaaaaaaaaaaaaaaaaaaaaaaaa",
  "observed_head_sha": "aaaaaaaaaaaaaaaaaaaaaaaaaaaaaaaaaaaaaaaa",
  "outcome": "dispatched-covered",
  "reason": "post-dispatch provider evidence binds the live expected base/head observation",
  "coverage": {
    "complete": true,
    "gate_satisfied": true,
    "basis": "post_dispatch_provider_evidence",
    "temporally_correlated": true,
    "command_correlated": true,
    "maximum_evidence_skew_seconds": 300,
    "not_before": "2026-09-07T12:00:00Z",
    "required_evidence": [
      "coderabbit_app_review_completed_status",
      "substantive_exact_head_coderabbit_bot_review",
      "post_dispatch_coderabbit_command_acknowledgement",
      "bounded_completion_time_skew"
    ],
    "status": {
      "id": 11,
      "context": "CodeRabbit",
      "state": "success",
      "description": "Review completed",
      "provider_app_id": 347564,
      "creator_id": 136622811,
      "creator_login": "coderabbitai[bot]",
      "created_at": "2026-09-07T12:02:00Z",
      "updated_at": "2026-09-07T12:02:01Z"
    },
    "review": {
      "id": 17,
      "state": "COMMENTED",
      "commit_id": "aaaaaaaaaaaaaaaaaaaaaaaaaaaaaaaaaaaaaaaa",
      "submitted_at": "2026-09-07T12:02:00Z",
      "body_bytes": 96,
      "body_sha256": "1111111111111111111111111111111111111111111111111111111111111111",
      "reviewer_id": 136622811,
      "reviewer_login": "coderabbitai[bot]"
    },
    "acknowledgement": {
      "id": 23,
      "created_at": "2026-09-07T12:00:05Z",
      "updated_at": "2026-09-07T12:02:01Z",
      "body_bytes": 111,
      "body_sha256": "2222222222222222222222222222222222222222222222222222222222222222",
      "command_handle": "12345678-1234-4abc-8def-123456789abc",
      "full_review_finished": true,
      "reviewer_id": 136622811,
      "reviewer_login": "coderabbitai[bot]"
    }
  },
  "dispatch": {
    "comment_id": 29,
    "created_at": "2026-09-07T12:00:00Z",
    "command": "@coderabbitai full review",
    "lease": "created",
    "lease_status_id": 101
  },
  "gate": {
    "context": "StrataDiff Final Head",
    "state": "success"
  },
  "attestation": null,
  "claim_boundary": "Unsigned live GitHub observation with provider and base/head correlation."
}
